{
  "$id": "https://commandlayer.org/schemas/v1.1.0/commercial/ship/ship.receipt.schema.json",
  "$schema": "https://json-schema.org/draft/2020-12/schema",
  "title": "ship.receipt",
  "description": "Canonical commercial fulfillment state transition receipt tied to settlement-backed fulfillment work.",
  "type": "object",
  "additionalProperties": false,
  "$defs": {
    "actor": {
      "type": "object",
      "additionalProperties": false,
      "required": [
        "role",
        "id"
      ],
      "properties": {
        "role": {
          "type": "string",
          "enum": [
            "payer",
            "payee",
            "merchant",
            "provider",
            "carrier",
            "verifier"
          ]
        },
        "id": {
          "type": "string",
          "minLength": 1,
          "maxLength": 128
        },
        "kind": {
          "type": "string",
          "enum": [
            "agent",
            "organization",
            "wallet",
            "account",
            "service",
            "human"
          ]
        },
        "display_name": {
          "type": "string",
          "maxLength": 128
        },
        "uri": {
          "type": "string",
          "format": "uri",
          "maxLength": 512
        }
      }
    },
    "reference": {
      "type": "object",
      "additionalProperties": false,
      "required": [
        "type",
        "id"
      ],
      "properties": {
        "type": {
          "type": "string",
          "enum": [
            "order",
            "invoice",
            "authorization",
            "checkout",
            "purchase",
            "shipment",
            "fulfillment",
            "payment",
            "settlement",
            "receipt",
            "payment_requirement",
            "payment_session",
            "proof",
            "agent_card"
          ]
        },
        "id": {
          "type": "string",
          "minLength": 1,
          "maxLength": 128
        },
        "uri": {
          "type": "string",
          "format": "uri",
          "maxLength": 512
        }
      }
    }
  },
  "properties": {
    "protocol": {
      "type": "string",
      "const": "commercial"
    },
    "version": {
      "type": "string",
      "const": "1.1.0"
    },
    "verb": {
      "type": "string",
      "const": "ship"
    },
    "receipt_id": {
      "type": "string",
      "minLength": 1,
      "maxLength": 128
    },
    "issued_at": {
      "type": "string",
      "format": "date-time"
    },
    "request_id": {
      "type": "string",
      "minLength": 1,
      "maxLength": 128
    },
    "status": {
      "type": "string",
      "enum": [
        "label_created",
        "in_transit",
        "delivered",
        "failed",
        "returned"
      ]
    },
    "shipment_id": {
      "type": "string",
      "minLength": 1,
      "maxLength": 128
    },
    "merchant": {
      "allOf": [
        {
          "$ref": "#/$defs/actor"
        },
        {
          "type": "object",
          "properties": {
            "role": {
              "const": "merchant"
            }
          },
          "required": [
            "role"
          ]
        }
      ]
    },
    "carrier": {
      "allOf": [
        {
          "$ref": "#/$defs/actor"
        },
        {
          "type": "object",
          "properties": {
            "role": {
              "const": "carrier"
            }
          },
          "required": [
            "role"
          ]
        }
      ]
    },
    "order_ref": {
      "$ref": "#/$defs/reference"
    },
    "purchase_ref": {
      "allOf": [
        {
          "$ref": "#/$defs/reference"
        },
        {
          "type": "object",
          "properties": {
            "type": {
              "const": "purchase"
            }
          },
          "required": [
            "type"
          ]
        }
      ]
    },
    "settlement_ref": {
      "allOf": [
        {
          "$ref": "#/$defs/reference"
        },
        {
          "type": "object",
          "properties": {
            "type": {
              "const": "settlement"
            }
          },
          "required": [
            "type"
          ]
        }
      ]
    },
    "fulfillment_ref": {
      "allOf": [
        {
          "$ref": "#/$defs/reference"
        },
        {
          "type": "object",
          "properties": {
            "type": {
              "const": "fulfillment"
            }
          },
          "required": [
            "type"
          ]
        }
      ]
    },
    "tracking_number": {
      "type": "string",
      "minLength": 6,
      "maxLength": 128
    },
    "tracking_url": {
      "type": "string",
      "format": "uri",
      "maxLength": 512
    },
    "delivery_proof_ref": {
      "allOf": [
        {
          "$ref": "#/$defs/reference"
        },
        {
          "type": "object",
          "properties": {
            "type": {
              "const": "proof"
            }
          },
          "required": [
            "type"
          ]
        }
      ]
    },
    "event_at": {
      "type": "string",
      "format": "date-time"
    },
    "reason": {
      "type": "string",
      "maxLength": 512
    }
  },
  "required": [
    "protocol",
    "version",
    "verb",
    "receipt_id",
    "issued_at",
    "request_id",
    "status",
    "shipment_id",
    "merchant",
    "purchase_ref",
    "settlement_ref",
    "fulfillment_ref",
    "event_at"
  ],
  "allOf": [
    {
      "if": {
        "properties": {
          "status": {
            "const": "label_created"
          }
        }
      },
      "then": {
        "required": [
          "carrier",
          "tracking_number"
        ],
        "properties": {
          "carrier": {
            "$ref": "#/$defs/actor"
          },
          "tracking_number": {
            "type": "string",
            "minLength": 6,
            "maxLength": 128
          }
        }
      }
    },
    {
      "if": {
        "properties": {
          "status": {
            "const": "in_transit"
          }
        }
      },
      "then": {
        "required": [
          "carrier",
          "tracking_number",
          "tracking_url"
        ],
        "properties": {
          "carrier": {
            "$ref": "#/$defs/actor"
          },
          "tracking_number": {
            "type": "string",
            "minLength": 6,
            "maxLength": 128
          },
          "tracking_url": {
            "type": "string",
            "format": "uri",
            "maxLength": 512
          }
        }
      }
    },
    {
      "if": {
        "properties": {
          "status": {
            "const": "delivered"
          }
        }
      },
      "then": {
        "required": [
          "carrier",
          "tracking_number",
          "tracking_url",
          "delivery_proof_ref"
        ],
        "properties": {
          "carrier": {
            "$ref": "#/$defs/actor"
          },
          "tracking_number": {
            "type": "string",
            "minLength": 6,
            "maxLength": 128
          },
          "tracking_url": {
            "type": "string",
            "format": "uri",
            "maxLength": 512
          },
          "delivery_proof_ref": {
            "$ref": "#/$defs/reference"
          }
        }
      }
    },
    {
      "if": {
        "properties": {
          "status": {
            "enum": [
              "failed",
              "returned"
            ]
          }
        }
      },
      "then": {
        "required": [
          "reason"
        ],
        "properties": {
          "reason": {
            "type": "string",
            "maxLength": 512
          }
        }
      }
    }
  ]
}
