{
  "protocol": "commercial",
  "version": "1.1.0",
  "verb": "ship",
  "receipt_id": "shiprcpt-002",
  "issued_at": "2026-03-19T18:45:00Z",
  "request_id": "shipreq-002",
  "status": "delivered",
  "shipment_id": "shipment-002",
  "merchant": {
    "role": "merchant",
    "id": "merchant.example",
    "kind": "organization"
  },
  "carrier": {
    "role": "carrier",
    "id": "dhl",
    "kind": "service"
  },
  "purchase_ref": {
    "type": "purchase",
    "id": "purchase-3002"
  },
  "settlement_ref": {
    "type": "settlement",
    "id": "settle-3002"
  },
  "fulfillment_ref": {
    "type": "fulfillment",
    "id": "fulfillment-3002"
  },
  "tracking_number": "JD014600006838239000",
  "tracking_url": "https://carrier.example/track/JD014600006838239000",
  "delivery_proof_ref": {
    "type": "proof",
    "id": "delivery-proof-3002",
    "uri": "https://carrier.example/proofs/delivery-proof-3002"
  },
  "event_at": "2026-03-19T18:45:00Z"
}
